Id,ProductId,UserId,Time,Summary,Text
1,B001E4KFG0,KJAGXH7AUH9911,1730162185,This vacuum does the job but the battery drains too quickly
2,B00JH782HG,188GXH7AUHMANS,1730178273,The Guster Umbrella is supposed to be able to withstand strong gusts of wind but it turns inside out on me even in a light breeze
4,B00LKSG871,BJ87127AUH001P,1730183800,I bought this kitchen rug but am not very happy with it because it has already started to fray
5,B01GHDJ81J,A3SGXH7AUHU8GW,1730191825,Snowball hates the smell of these salmon flavored treats
5,B0991KJS91,9KAJSH7AUHDDHA,1730191918,This Car Air Freshener actually makes my car smell worse like liver and onions